{"checks":[{"code":"BLOCKED_BY_IMAGE_BUILD","id":"runner","status":"FAIL"}],"constraints":{"artifact_mount":"read-only","capabilities":"drop-all","docker_socket":false,"gid":65532,"git_mount":"read-only","network":"none","no_new_privileges":true,"path_source":"image-fixed-absolute","rootfs":"read-only","seccomp":"default","uid":65532},"error_code":"BLOCKED_BY_IMAGE_BUILD","expectations":{"artifact_commit":"0000000000000000000000000000000000000000","manifest_sha256":"sha256:0000000000000000000000000000000000000000000000000000000000000000","schema_sha256":"sha256:0000000000000000000000000000000000000000000000000000000000000000","validator_sha256":"sha256:0000000000000000000000000000000000000000000000000000000000000000"},"image":{"child_digest":"sha256:0000000000000000000000000000000000000000000000000000000000000000","config_digest":"sha256:0000000000000000000000000000000000000000000000000000000000000000","platform":"linux/amd64"},"integrity":{"algorithm":"sha256-canonical-json-excluding-integrity","payload_sha256":"sha256:ea79114c1171eb497b4b7d1118d93b3305394cd7bfb6b59882952858c8197e9a"},"observed":{"manifest_sha256":"sha256:0000000000000000000000000000000000000000000000000000000000000000","mounts":{"artifact":"ro","git":"ro","rootfs":"ro"},"ocr_parity":"UNKNOWN","ocr_sha256":null,"resource_limits":{"cpus":"100000 100000","memory":"536870912","memory_swap":"0","nofile":"1024:1024","pids":"128","tmpfs":"/tmp:rw,noexec,nosuid,nodev,size=64m"},"video_sha256":"sha256:0000000000000000000000000000000000000000000000000000000000000000"},"overall_status":"FAIL","schema":"proofflow.reference-runtime-oci-verifier.receipt.v1","toolchain":{"ffmpeg":{"path":"/usr/bin/ffmpeg","sha256":"sha256:0000000000000000000000000000000000000000000000000000000000000000","version":"unavailable"},"ffprobe":{"path":"/usr/bin/ffprobe","sha256":"sha256:0000000000000000000000000000000000000000000000000000000000000000","version":"unavailable"},"fonts":{"file_count":0,"root":"/usr/share/fonts/noto-cjk","sha256":"sha256:0000000000000000000000000000000000000000000000000000000000000000"},"git":{"path":"/usr/bin/git","sha256":"sha256:0000000000000000000000000000000000000000000000000000000000000000","version":"unavailable"},"jsonschema":"0.0.0","locale":"C.UTF-8","python":{"path":"/usr/local/bin/python3.12","sha256":"sha256:0000000000000000000000000000000000000000000000000000000000000000","version":"unavailable"},"tessdata":[{"path":"/usr/share/tessdata/eng.traineddata","sha256":"sha256:0000000000000000000000000000000000000000000000000000000000000000"},{"path":"/usr/share/tessdata/chi_sim.traineddata","sha256":"sha256:0000000000000000000000000000000000000000000000000000000000000000"}],"tesseract":{"path":"/usr/bin/tesseract","sha256":"sha256:0000000000000000000000000000000000000000000000000000000000000000","version":"unavailable"}},"verifier":{"platform":"linux/amd64","receipt_schema_sha256":"sha256:a1a557c17dfaaf85dfd8d3c45e061af8ce30428cb650b65033a579be62202552","source_sha256":"sha256:0000000000000000000000000000000000000000000000000000000000000000","version":"1.0.0"}}
